product_key,product_id,product_name,product_line,quantity_in_stock,product_price,reviewer,review_text,rating
1,S10_1678,"1969 Harley Davidson Ultimate Chopper",Motorcycles,7933,48.81,"Jennifer Lawson","Forget second police admit beautiful item. Prove network least story today team remember. Pick chair miss newspaper until car. Such list time me full where.",2
2,S10_1949,"1952 Alpine Renault 1300","Classic Cars",7305,98.58,"Ian Melendez","Interesting senior someone half. Church throughout free point ready ask.",4
3,S10_2016,"1996 Moto Guzzi 1100i",Motorcycles,6625,68.99,"Travis Jackson","Agency skin himself option paper subject upon. Evidence the five she. Prevent impact shoulder water civil however design.",2
4,S10_4698,"2003 Harley-Davidson Eagle Drag Bike",Motorcycles,5582,91.02,"Scott Shaw","Quality fall much crime could. Today network probably issue hard already job hold.",3
5,S10_4757,"1972 Alfa Romeo GTA","Classic Cars",3252,85.68,"Abigail Ross","Know cultural be tell local. Career suddenly he big ability ask. Activity environmental rather visit.",3
6,S10_4962,"1962 LanciaA Delta 16V","Classic Cars",6791,103.42,"Alexis Fuentes","Produce issue all ask expert. Bank force issue impact certain control. Bad ready senior local energy establish.",2
7,S12_1099,"1968 Ford Mustang","Classic Cars",68,95.34,"Ryan Smith","Against policy recognize behind exactly night than. Music Mr gas front down drive go difference. Play cold really my four.",1
8,S12_1108,"2001 Ferrari Enzo","Classic Cars",3619,95.59,"Brandon Townsend","Security traditional health clearly race huge economy. Thus hope those when theory. Action town down prove employee.",4
9,S12_1666,"1958 Setra Bus","Trucks and Buses",1579,77.9,"Michael Simpson","Before those relate away care. Could old use who civil fear improve.",1
10,S12_2823,"2002 Suzuki XREO",Motorcycles,9997,66.27,"Shawn Browning","Reality remain anyone bill music. Professional wear evening answer.",1
11,S12_3148,"1969 Corvair Monza","Classic Cars",6906,89.14,"Troy Buck","Drug yes employee. Something thought audience add. Company style teach picture example. Serve top statement stage cover.",1
12,S12_3380,"1968 Dodge Charger","Classic Cars",9123,75.16,"Diane Stevens","Score commercial popular area. Probably partner market. North community fall.",1
13,S12_3891,"1969 Ford Falcon","Classic Cars",1049,83.05,"Matthew Hull","Adult decision region. Take bar control present business guy thing.",2
14,S12_3990,"1970 Plymouth Hemi Cuda","Classic Cars",5663,31.92,"Bobby Howard","Wide TV late under remember party. Increase control popular cost middle. Walk perhaps particular increase hit.",1
15,S12_4473,"1957 Chevy Pickup","Trucks and Buses",6125,55.7,"Margaret Ingram","Walk reveal smile school recent will describe. Difficult science room word assume age teacher. Pay return activity nothing identify wrong price opportunity. Doctor somebody here door go write commercial.",5
16,S12_4675,"1969 Dodge Charger","Classic Cars",7323,58.73,"Kelly Best","Scene by professional local design. Wish her best. Foreign issue set lawyer. Nothing us old reason.",4
17,S18_1097,"1940 Ford Pickup Truck","Trucks and Buses",2613,58.33,"Tara Gray","Pm decide through agree ground personal front. Just ever senior behavior hotel activity move debate. On body million usually story sport painting.",5
18,S18_1129,"1993 Mazda RX-7","Classic Cars",3975,83.51,"Eric Ali","Mr three arm grow dog yourself. Vote southern say soldier. Break have yes ago season general baby.",4
19,S18_1342,"1937 Lincoln Berline","Vintage Cars",8693,60.62,"Brenda Fernandez","Network factor do fear once four. Start successful once cost ever. Realize education pattern movement against low.",1
20,S18_1367,"1936 Mercedes-Benz 500K Special Roadster","Vintage Cars",8635,24.26,"Christian Bentley","Series anyone move ready road start add economic. Collection reason cover under know.",1
21,S18_1589,"1965 Aston Martin DB5","Classic Cars",9042,65.96,"Benjamin Valdez","College sister on evening participant state him. Stuff break cause usually hair today suddenly. Detail discussion mention weight force.",1
22,S18_1662,"1980s Black Hawk Helicopter",Planes,5330,77.27,"John Smith","Themselves attack choice happen thus. Different turn message think ability shoulder return.",5
23,S18_1749,"1917 Grand Touring Sedan","Vintage Cars",2724,86.7,"Troy Wright","See agree specific wide cover. Everything quickly worry after present grow.",4
24,S18_1889,"1948 Porsche 356-A Roadster","Classic Cars",8826,53.9,"Jordan Jones","Test modern campaign size ability under discover green. Beautiful thank generation stock.",4
25,S18_1984,"1995 Honda Civic","Classic Cars",9772,93.89,"Nicole Johnson","Final job eye in these. Newspaper modern even eye safe wind family. Occur pressure leave true.",2
26,S18_2238,"1998 Chrysler Plymouth Prowler","Classic Cars",4724,101.51,"Jacob Russell","Without concern book ahead lead sure. Imagine stuff though issue dinner goal loss. Practice leave tree past.",5
27,S18_2248,"1911 Ford Town Car","Vintage Cars",540,33.3,"Shelby Clark","Piece star condition religious around remain. Training same without. Rule able ever peace address pass act forget.",4
28,S18_2319,"1964 Mercedes Tour Bus","Trucks and Buses",8258,74.86,"Karen Phillips","Positive big decade close our. Politics toward prevent test local society. Whose parent report throw floor deal conference.",2
29,S18_2325,"1932 Model A Ford J-Coupe","Vintage Cars",9354,58.48,"John Murphy","Team billion head only discuss force thousand. Condition page daughter task once local certainly skin. Than government attack write certainly politics issue.",2
30,S18_2432,"1926 Ford Fire Engine","Trucks and Buses",2018,24.92,"Joseph Pope","Western policy daughter sport factor behind final. Way job trouble foreign pass identify race. Station party conference industry lay article force.",2
31,S18_2581,"P-51-D Mustang",Planes,992,49,"Bradley Lopez","Do enjoy face hard positive pass discussion rich. Natural not happen open. Interview understand play into against rock key travel.",1
32,S18_2625,"1936 Harley Davidson El Knucklehead",Motorcycles,4357,24.23,"Beth Willis","Beautiful hard part gun watch. Type other success east have family. We hope western skin step. Six against game well hold often serious.",4
33,S18_2795,"1928 Mercedes-Benz SSK","Vintage Cars",548,72.56,"David Horn","At southern offer great sense group smile such. Pretty himself similar read find. Interest among left yeah either.",1
34,S18_2870,"1999 Indy 500 Monte Carlo SS","Classic Cars",8164,56.76,"Randall Smith","Early think kind call mean. Student health side people sister reason throw. Position forward poor option of apply instead support. Base each want firm do.",4
35,S18_2949,"1913 Ford Model T Speedster","Vintage Cars",4189,60.78,"Joe Roach","Letter way control entire provide organization open. About create teacher position program affect especially. Direction threat student often.",2
36,S18_2957,"1934 Ford V8 Coupe","Vintage Cars",5649,34.35,"Michelle Keith","Least rather article. Quality stop shake avoid small shoulder enter possible. Across sure individual class operation half television.",2
37,S18_3029,"1999 Yamaha Speed Boat",Ships,4259,51.61,"Rebecca Valentine","Indeed leg necessary discover face even. Four career apply feel minute factor.",4
38,S18_3136,"18th Century Vintage Horse Carriage","Vintage Cars",5992,60.74,"Brian Bishop","Understand will moment character seven. Find main learn out discussion goal source. Risk push development.",5
39,S18_3140,"1903 Ford Model A","Vintage Cars",3913,68.3,"Tiffany Cook","Little hospital give onto near. Black challenge save role open member part. Party bit herself entire however.",1
40,S18_3232,"1992 Ferrari 360 Spider red","Classic Cars",8347,77.9,"Karen Lopez","Likely development increase assume teacher.",5
41,S18_3233,"1985 Toyota Supra","Classic Cars",7733,57.01,"Lee Brown","Back region baby key local line news. Take employee approach after official knowledge own.",1
42,S18_3259,"Collectable Wooden Train",Trains,6450,67.56,"Gabriel Perez","Send box blue to. List resource father own.",2
43,S18_3278,"1969 Dodge Super Bee","Classic Cars",1917,49.05,"Colton Morris","These rise city see up. Care wonder space describe. Control simply media voice her rich now.",3
44,S18_3320,"1917 Maxwell Touring Car","Vintage Cars",7913,57.54,"Michelle Spencer","Feeling effect ball film.",2
45,S18_3482,"1976 Ford Gran Torino","Classic Cars",9127,73.49,"Christopher Greene","Member speak quality right thought give remain. Garden to check admit wonder hair chance. Seek miss strong special human discussion.",4
46,S18_3685,"1948 Porsche Type 356 Roadster","Classic Cars",8990,62.16,"Bradley Mcintosh","Let responsibility tree local. Increase condition worry relationship garden. Explain window moment.",3
47,S18_3782,"1957 Vespa GS150",Motorcycles,7689,32.95,"Paul Smith","Where responsibility serve I phone school book. Concern own car half few quite deep.",4
48,S18_3856,"1941 Chevrolet Special Deluxe Cabriolet","Vintage Cars",2378,64.58,"Martin Shepherd","Argue rich money avoid ready attack rest. Evening decade difficult table attorney. Myself responsibility personal market collection.",2
49,S18_4027,"1970 Triumph Spitfire","Classic Cars",5545,91.92,"Jeremy Hendricks","Color rate away any friend believe produce. Produce general six game necessary grow. Future brother fund month system role.",1
50,S18_4409,"1932 Alfa Romeo 8C2300 Spider Sport","Vintage Cars",6553,43.26,"Whitney Gutierrez","Trade generation his fill ten speak big. Nothing industry her ask spend watch help.",5
51,S18_4522,"1904 Buick Runabout","Vintage Cars",8290,52.66,"Shannon Thomas","He stay friend my system degree. Ok want keep growth gun difficult.",4
52,S18_4600,"1940s Ford truck","Trucks and Buses",3128,84.76,"David Diaz","Why she off know. Final game past each wind matter.",4
53,S18_4668,"1939 Cadillac Limousine","Vintage Cars",6645,23.14,"Jeffrey Osborne","Paper mean view financial. Protect quality leg federal. Participant strategy wall should.",4
54,S18_4721,"1957 Corvette Convertible","Classic Cars",1249,69.93,"Julie Diaz","Game rest yes military yourself successful data. Work environmental reduce administration employee old. By fast behavior rather less mother safe talk. Discover teach price paper require common system.",5
55,S18_4933,"1957 Ford Thunderbird","Classic Cars",3209,34.21,"Scott Shelton","Can reach happy billion edge.",5
56,S24_1046,"1970 Chevy Chevelle SS 454","Classic Cars",1005,49.24,"Brian Scott","Guess time avoid. Strategy likely reduce staff.",1
57,S24_1444,"1970 Dodge Coronet","Classic Cars",4074,32.37,"Kimberly Henson","Practice brother value because quality.",3
58,S24_1578,"1997 BMW R 1100 S",Motorcycles,7003,60.86,"Francis Anderson","Beyond build civil ever. Coach show hotel bad build research.",4
59,S24_1628,"1966 Shelby Cobra 427 S/C","Classic Cars",8197,29.18,"Gregory Castaneda","What nature stop attack arm. Board claim worker scene into front wife.",5
60,S24_1785,"1928 British Royal Navy Airplane",Planes,3627,66.74,"Douglas Brown","Bank society charge performance seven nice line. Surface management fly husband kid.",1
61,S24_1937,"1939 Chevrolet Deluxe Coupe","Vintage Cars",7332,22.57,"Randy Martin","Morning very parent half whether. Recently we produce focus. Action catch few nor affect than tend.",2
62,S24_2000,"1960 BSA Gold Star DBD34",Motorcycles,15,37.32,"Matthew Hunt","Character whom when design sort. Pick price before finish cup nor write floor.",1
63,S24_2011,"18th century schooner",Ships,1898,82.34,"Brad Davis","Within act gun civil board break southern gas. Piece rise energy government which. Five imagine save room card.",5
64,S24_2022,"1938 Cadillac V-16 Presidential Limousine","Vintage Cars",2847,20.61,"Dale Kidd","Speech effect source keep deep majority. Music herself role majority stand.",3
65,S24_2300,"1962 Volkswagen Microbus","Trucks and Buses",2327,61.34,"Thomas Gonzalez","Mouth finally chair sure help. Born relationship feeling degree his might serious.",4
66,S24_2360,"1982 Ducati 900 Monster",Motorcycles,6840,47.1,"Karen Duffy","Pick art base wide worker. Memory fast form try.",5
67,S24_2766,"1949 Jaguar XK 120","Classic Cars",2350,47.25,"Benjamin Carey","Social green western two list. Near free thank kid decision indeed international order.",2
68,S24_2840,"1958 Chevy Corvette Limited Edition","Classic Cars",2542,15.91,"Matthew Shelton","Environment work trouble firm central. Marriage six something because guy national loss their.",1
69,S24_2841,"1900s Vintage Bi-Plane",Planes,5942,34.25,"Adrian Hardy","Less east onto. Course head but just food trouble. Set they avoid number happen.",2
70,S24_2887,"1952 Citroen-15CV","Classic Cars",1452,72.82,"Karen Walker","Direction speech dream history. Recognize reality tell per. Buy body significant factor past. Yourself wish sound occur.",3
71,S24_2972,"1982 Lamborghini Diablo","Classic Cars",7723,16.24,"Christine Burns","Time public defense statement but. Might avoid how area phone vote. Already particularly wrong standard remember act agree.",2
72,S24_3151,"1912 Ford Model T Delivery Wagon","Vintage Cars",9173,46.91,"Natalie Collier","Here particularly drive off feeling. May sport performance assume. Step take behavior could kind. Moment leader simple blood.",3
73,S24_3191,"1969 Chevrolet Camaro Z28","Classic Cars",4695,50.51,"Jason Jones","Approach PM important training power stock. Contain citizen knowledge himself want direction push. Night at exactly whom.",2
74,S24_3371,"1971 Alpine Renault 1600s","Classic Cars",7995,38.58,"Jon Steele","Blue radio tell who. Role state series phone decade bag miss perform. Direction hand task forget determine owner apply.",3
75,S24_3420,"1937 Horch 930V Limousine","Vintage Cars",2902,26.3,"Melissa Webb","Century wife born suffer. Tree born visit.",4
76,S24_3432,"2002 Chevy Corvette","Classic Cars",9446,62.11,"Kari Fields","Citizen while brother learn dream body main. Speak benefit decision region use. Glass player experience it.",3
77,S24_3816,"1940 Ford Delivery Sedan","Vintage Cars",6621,48.64,"Laura Smith","Stay but sound step leader attack. Opportunity production general before. Ball past nice.",3
78,S24_3856,"1956 Porsche 356A Coupe","Classic Cars",6600,98.3,"Joseph Clark","Culture local feeling career yes community. Per value happen traditional. Itself civil realize agreement like. Lot month real president past without them.",5
79,S24_3949,"Corsair F4U ( Bird Cage)",Planes,6812,29.34,"Erica Stewart","Financial gas skill live individual save sometimes. Article end happen. Enjoy hold bring.",3
80,S24_3969,"1936 Mercedes Benz 500k Roadster","Vintage Cars",2081,21.75,"Nicole Arellano","Animal tough senior card face new. Right cover quickly more nearly. Exist believe method also nearly hour in. Democratic could hour example hair food situation out.",3
81,S24_4048,"1992 Porsche Cayenne Turbo Silver","Classic Cars",6582,69.78,"Mary Crawford","Less eye industry on. Black society TV participant answer believe air. Movie focus thus act peace.",3
82,S24_4258,"1936 Chrysler Airflow","Vintage Cars",4710,57.46,"Daniel Nguyen","Song central rock always enter. It court already exist sometimes manage above fly.",3
83,S24_4278,"1900s Vintage Tri-Plane",Planes,2756,36.23,"Rebecca Jones","Class meeting weight culture wish support. House court radio degree. Paper statement old grow.",2
84,S24_4620,"1961 Chevrolet Impala","Classic Cars",7869,32.33,"Mike Green","Blue traditional us tell stay each. Cell instead reveal back. Friend local film black carry.",4
85,S32_1268,"1980’s GM Manhattan Express","Trucks and Buses",5099,53.93,"Lisa Gordon","Indicate phone well quickly building. Subject evidence total sense imagine certainly everything. Follow main blood rate see debate media.",2
86,S32_1374,"1997 BMW F650 ST",Motorcycles,178,66.92,"Mr. Gregory Brown","Laugh western down arrive teacher strong mission. Note sometimes beyond send financial organization good.",4
87,S32_2206,"1982 Ducati 996 R",Motorcycles,9241,24.14,"Matthew Ortega","Save history people check work participant indicate.",2
88,S32_2509,"1954 Greyhound Scenicruiser","Trucks and Buses",2874,25.98,"Justin Wells","Pretty clearly thousand several wait. Move growth because increase head record current. Many figure hundred think.",1
89,S32_3207,"1950's Chicago Surface Lines Streetcar",Trains,8601,26.72,"Felicia Cruz","Decade strong culture administration difference force citizen. Maybe miss meet. Peace actually interest born pass social kind.",2
90,S32_3522,"1996 Peterbilt 379 Stake Bed with Outrigger","Trucks and Buses",814,33.61,"Alicia Dean","Show wear contain close success whether. Nice star hit usually choice. Customer history civil too huge.",5
91,S32_4289,"1928 Ford Phaeton Deluxe","Vintage Cars",136,33.02,"Jeffrey Jennings","Central story challenge stage development several. Defense gas decision. Out lay center have.",5
92,S32_4485,"1974 Ducati 350 Mk3 Desmo",Motorcycles,3341,56.13,"Alexander Holden","At impact subject leader laugh manage behavior. Scene throughout expert area image very allow.",1
93,S50_1341,"1930 Buick Marquette Phaeton","Vintage Cars",7062,27.06,"Jennifer Miller","Skin model research side budget ask wind. Close east right out.",1
94,S50_1392,"Diamond T620 Semi-Skirted Tanker","Trucks and Buses",1016,68.29,"Janet Alexander","Whatever power wind however watch support. Mr make wrong.",3
95,S50_1514,"1962 City of Detroit Streetcar",Trains,1645,37.49,"Rebecca Brown","Step keep before form popular song. Represent able message son.",3
96,S50_4713,"2002 Yamaha YZR M1",Motorcycles,600,34.17,"Scott Williams","Someone name realize. Simply because parent approach generation clearly. Eye like foreign they everyone from learn.",5
97,S700_1138,"The Schooner Bluenose",Ships,1897,34,"Megan Welch","Believe child set or expert western.",3
98,S700_1691,"American Airlines: B767-300",Planes,5841,51.15,"Patrick Roberts","Charge design word not answer game either form. Down bar indicate condition expect cause. Reflect prepare environmental natural theory wish.",4
99,S700_1938,"The Mayflower",Ships,737,43.3,"Barbara Walker","Number wife water. Forget by project.",4
100,S700_2047,"HMS Bounty",Ships,3501,39.83,"Luis Griffith","Scientist loss power approach team. School finish well.",5
101,S700_2466,"America West Airlines B757-200",Planes,9653,68.8,"Gregory Campos","Window answer ask nice. Dinner bank suffer among nation trip. Election service throughout address.",4
102,S700_2610,"The USS Constitution Ship",Ships,7083,33.97,"Alison Guerrero","So song plant make may away ask. Imagine figure various point camera reason.",1
103,S700_2824,"1982 Camaro Z28","Classic Cars",6934,46.53,"Sydney Nixon","Environmental talk agreement. Know hand student night three design it. On community prove usually.",1
104,S700_2834,"ATA: B757-300",Planes,7106,59.33,"Antonio Collins","Number pick describe also success themselves test.",1
105,S700_3167,"F/A 18 Hornet 1/72",Planes,551,54.4,"John Moore","Window total board less almost reality. Project lot condition. Sell information fact century organization.",4
106,S700_3505,"The Titanic",Ships,1956,51.09,"Jason Wade","Relate reason deep range deep of couple. Let prepare total same herself compare trade example.",3
107,S700_3962,"The Queen Mary",Ships,5088,53.63,"Mitchell Cobb","Case six wear necessary. Fact their anyone national individual ahead study news.",4
108,S700_4002,"American Airlines: MD-11S",Planes,8820,36.27,"Amanda Anderson","Each play range tax make floor. Late year race attack five too. Service someone little indeed recently yes.",5
109,S72_1253,"Boeing X-32A JSF",Planes,4857,32.77,"Vanessa Leach","National less discuss some garden management current benefit. Meet case project than still guy receive. Place federal four huge want.",3
110,S72_3212,"Pont Yacht",Ships,414,33.3,"Kimberly Knight","Ever whatever resource war. Picture bank professor rather mission. Strong part north son assume either rest.",1
